timestamp,name,text
[00:00:05.16],Liz,"Okay so, I don't have to use the chat, I am just gonna use the human chat, right?"
[00:00:12.24],Maggie,"Yeah, the old fashion way "
[00:00:14.27],Liz,"Unofficially I am going to talk to you, well okay. This is lovely, I am ready"
[00:00:21.24],Maggie,"Excellent. Yeah so, just to kind of, ah the eagles eyes view, or where it will land a little bit, ah what kind of brought us to this point was, we've been looking more closely to into the new terrain project and the terrain side of things. And a big part of that is ah and or really I, within that reviewing the evaluation documents that Theresa sent us about new gen thing and we were specifically reviewing the survey responses from participants about their hub groups, which we thought were interesting and somewhat all over the place and so we were curious to see a little bit from your perspective about your experience with them, or your impression, your takeaways from the. And with that more specific or specific interview questions. Jean is there anything I am missing that you wanna add one? [Jean is on mute] Oh, I cant hear you."
[00:01:32.17],Liz,Sorry I couldn't hear Jean either
[00:01:36.21],Maggie,Oh we still can't hear you
[00:01:40.27],Jean,"I muted myself because I was gonna be on the keyboard and you would have to hear the keys go clack clack clack. This was been an evolution in our thinking, Liz "
[00:01:57.03],Liz,"I am very interested, tell me more"
[00:01:59.17],Jean,"Well, just two things, we had that really really good talk with you and we have tried to knit together, what Teresa did. with respect to the survey work and other material that she send in to the department of ed. And then I- it dawned on me one day that a person we cannot leave out of this conversation is Sydney Kern. Because then she, when the program, the project was finished, she started project sing as you know. Which is a clear example of someone taking, a component of new terrain and um, I am blanking out, the next iteration. [Maggie: the projects] the (sand) and moving that, into a teacher education setting, and so that provided us we've had, you know, I think at least two of you have done more Maggie. Two calls? Two calls with her possible a third coming up, and what we discovered is she did some survey work herself so we have been looking to unpack that a little bit but it's clear that program had some elements of success to it and we were able to I think, we're gonna be able to sort leave all of that together, because it's great not only to see a model program being and active but also replicated in a way that needs particular audience "
[00:04:04.24],Liz,absolutely 
[00:04:06.01],Jean,"Then in that conversation with Cindy, again it dawned on me that we had these hub groups and they didn't really get the gravitas, the traction we may wanted to have but they were there, and they were a part of the new terrain, and so we wanted to circle back with you today and your thoughts on, Maggie had a lot of questions, I'll put myself on mute but that's kind of where we had been, since we talked with you and it's neat to see all the puzzle pieces kind of coming together "
[00:04:55.12],Liz,"Right, you know really good use of the term evolution Jean, because you talking over a period of time, when did we start, in 2013 I think?"
[00:05:07.03],Jean, We started 2013/2014
[00:05:17.16],Liz,"So you know you're looking over a period 6 years, a while and NGSX was evolving, NGSS was evolving, we haven't been dealing with stationary parts at all. You know for describing the project, you just have to keep that in the foreground sort of how much fluctuation there was in outcome, inputs were also fluctuating. "
[00:05:55.01],Jean," Well that's true, that is absolutely true but what I think each iteration there was greater definition [Liz: Huge] in the beginning to occur, and you know, we've got a think about that that's an important part of the evolution to capture "
[00:06:16.29],Liz,"Right, what we thought we needed at the beginning evolved over time, we didn't know what we needed, we knew what some of our constrains were, challenges were, definitely I would say our goals shifted, as the needs became more clear to us and I think probably need to continue to have, so that's a great opener in terms of the conversation about what I was thinking about hubs back in 2013, and what worked and what didn't work because of it, that might be the subject of a whole another paper is the evolution of the process, certainly we were building the airplane as we were flying it and adjusting and changing as we saw outcomes, so let's circle back in time to where we were in 2013"
[00:07:27.06],Jean,Maggie you take it over and I'll go back on mute 
[00:07:31.06],Maggie,Sounds good
[00:07:33.17],Liz,"Right, I just pressed on one. That's right what was your vision to the purpose of this subgroups?"
[00:07:40.23],Maggie,"Exactly, yeah "
[00:07:42.03],Liz,"Alright that was a opener, so I am going back now and in my mind you know as the state's science leader back then. What shaped my context was also development and adoption of the common core and I am not gonna try to not to do a lot of side bar walk but I am like context is everything it's very interesting. So just in brief, the release of common core standards happen in a very compressed way, well fairly in a very different way than NGSX, quite deliberately so, I happen to be the state lead apartment or common core adaption, so I was heavily involved in um, planning, there wasn't much planning for it because it was a given that every state was going to adapt you had to if you wanted to race to the top grant so the political context at the time was you're gonna take this standards and you're gonna join a testing (consursion) and maybe you will get a lot of money but it was certainly forced into the states policy, when at that time in my experience as the state leader, I was quite aware that our teacher preparation program were operating as very independent entities, Connecticut is a type of state, where everybody school districts, everybody likes there own space and nobody likes a state to tell them what to do-"
[00:10:03.04],Maggie,So just a-
[00:10:03.04],Liz,And I don't know- say that again
[00:10:05.23],Maggie,"Just a quick question, so independent you mean with a, that more state centered approach "
[00:10:15.00],Liz,"Strong centralized system, in some states where there is a, there a state, there is a state school, you know I can say this for sure, more similarities in the curriculum in the curriculum or in the programming, but in our systems there are certain standards that they need to meet but they need to meet them in many different ways. But you know in short, the important part, point that I wanted to make, the teacher prep programs very independent of each other and the faculty responsible for teaching science education course didn't know each other so in relatively small state let's say, I can't remember the exact number, we have 12 teacher step program, say there were 14 faculty members who all teach some sort of science teacher preparation course. there was no infrastructure to bring them together, no association, no meetings, no commonalities no communication, not only did they never collaborate before, they didn't even know each other as individuals, you know here I am back in time and I am watching this very sporadic bumpy adoption of common core standards which in some ways were very different than previous standards and in some ways not so different, it was a very you know, it was a process full of step and missteps and halts and starting again and I thought I have to do something differently going to achieve change on a large scale level, and so I would say, I would have to characterize changes that, I saw in science education in Connecticut in the 15 years that I was in the state education department very sporadic and spotty, little pockets, a isolated pockets here, this district was very forward thinking this district had a superintendent that valued science but small scale and nothing systemic, just little pockets of change that are happening here or there, you know its almost serendipitous, it's almost not measurable to stand up and say see how much better we're doing, so the first thing that in my mind was, gosh wouldn't it be great if there was a way for all of these teacher prep faculty to come together and share ideas and in some ways forge some commonalities across the board something that would feel more systemic at least among the teacher preparation, right it's a whole different challenge to be in service teachers even more challenging because they are spread out across in Connecticut you know in 169 towns, but I thought we could accomplish a lot of good things. So among the things I wanted to accomplish through hubs was first and foremost to bring together university faculty so they could get to know each other, might lead to increased collaboration so would illuminate around what next generation science teaching and learning. They were not all people actively involved in the development of next generation science, none of them were involved in the development. So without the hub coming together around NGSX I think there would have been, very little awareness and opportunity to upgrade their own thinking, so hubs were a meant to be a respectful of saying come take a look at this and see if you might think this might be a significant change and not same old same old we've been there done that, so those were two initial goals raising there awareness planting the seeds for them to change their own thinking about what is science teaching and learning look like in the next generation and inducing greater levels of collaboration among them, in a respectful setting without saying, here's the state coming in to tell you what you don't know"
[00:16:02.14],Maggie,"Right, that's that's-"
[00:16:05.04],Liz,Umm
[00:16:05.28],Maggie,"Yeah and do you feel that, that was able to come to fruition? Especially given that the hub groups turned out not to just be focused on higher education faculty and teacher preparation programs and faculty, yeah"
[00:16:28.17],Liz,"If keeping in mind that those were my two primary goals were designing hubs, I remember drawing out the diagram, cause I have people that are, you know distances away and they are busy people, this was not their highest priority at the time. You know dealing with the college faculty mindset which is, you know I took a look at this, I get it, I know what it means. So the hub our way to deal with the, the specifically distance separating them, so we're gonna try and make it convenient and easy for you to meet. NGSX was the critical anchor to that, cause they would be meeting in different locations and at different times that was more convenient for them but they were all working with the same material so there was a unifying factor, which continues to be which I think is one of the very best parts about NGSX as a professional learning system, you know it's unifying and so I think it was number 1 successful as the faculty got to know each other and they actually got to like each other and they got to trust each other and it led to continued collaboration, maybe not within every single one of them but the evidence of Cindy Kerns came off you know even though I am retired for three years now, you know I follow what's going on in the states, I can see that 2/3 of the faculty that were in new terrain everything with the Connecticut science teaching association during this professional development. That makes my heart think cause I used to think that never used to happen before and I feel as if it's attribute to the hubs "
[00:18:37.19],Maggie,Very cool
[00:18:38.12],Liz," And the ongoing relationships is it better than it was? Yes I think it is much better in term of collaboration and more consistency from higher ed to higher ed institution definitely more consistency, none was before. They all designed their own courses as long as they were following the NFDA standards teacher prep, which was written eons ago and I think are very outdated and I don't know if they have been updated. NGSX became a vehicle, not the perfect vehicle in that will lead I am sure to what comes out in surveys and what I know where the, not successes of it. But those two things getting them together, getting them to know each other and using them to work together in an ongoing basis, getting more consistency from across the different institution. I think that vision was realized that extenuate I have no way of knowing what's in there curriculum now, what they need but I do know from the, the grant projects that followed after new terrain that each of them at least in some way made an effort to incorporate next gen science teacher and learning aspects into their courses, at least I know that they were making that up. Which was something they just invented, you know it came from the work that we did in new terrain. "
[00:20:36.26],Maggie,"Right, and do you feel like, I guess just generally from anecdotal evidence do you feel like those changes and successes among the faculty in the hubs made it, or did it sort of trickle down into the successful implementation of NGSS or for the teachers as well. "
[00:21:02.20],Liz,"Yes, that's what's, I don't have the measures of that. That's where we always, I think it's just in the world of measurement, a project like this. It's really hard, but you can always collect data about what the project did, we did this, some did workshops, and we did this. You can always collect data about the input, getting the output in terms of change in teaching and then ultimately change in student thinking, those are the harder ones and most of the project don't attempt to do that, the projects that I funded with our MSP grant I really tried to push hard for some- get classroom evidence, get some baseline evidence, and we did try and do that with the faculty's curriculum, I remember in the beginning of new terrain we asked to, give their syllabus, what they were currently teaching and then do it again at the end of the 3-year project and look for change and I think we had at least change in what they were teaching. I know what isn't enough, at least I know that isn't enough for me , it's like okay what's happening in the k-12 classrooms, what's changing? How was it before? And how has it changed, I don't have good evidence of that, in one of the other MSD projects we had a video tape, we had somebody actually go out and video tape the classrooms. I wish I could say it's made a difference I don't know that"
[00:22:57.02],Maggie,"No yeah, absolutely "
[00:22:59.08],Liz,"As I am reflecting on you know. on the answer to my question about what my goal were for the hubs, I am noticing that most of it was not about NGSS or about NGSX most of it was about can we call get together, think collectively about what this means? Can we work together? Can we change it so that we have better consistency and about what was almost secondary but I will- it couldn't have happened without NGSX without a tool"
[00:23:40.14],Jean,"I was gonna say, is I think common experience that both teachers and faculty and teachers had together, was certainly stronger in some parts of the state than others and-"
[00:23:59.03],Liz,Oh gosh I am sure
[00:24:01.20],Jean,"There are examples for it, um at UConn, a paper was published Todd, TJ was a part of that which really looked at the hub and looked at what came out of it and I would say that UConn is one example and its interesting because it has a footprint in the state- "
[00:24:32.08],Liz,"Yeah but not in terms of number, not in terms of number of teachers that they produce, it's a big university but there one of the biggest teacher pr-"
[00:24:44.21],Jean,"-producers of it, yeah you're right "
[00:24:45.08],Liz,"But yeah go on, finish your thought "
[00:24:53.19],Jean,"All I wanna say is that, there are a number of ways in which, that faculty did come together although you know that was fits and starts, TJ served as a good magnet to try to get that faculty cohering um, and as you say it, it's a difficult position no matter where higher ed is just that way but I think that's an example and I don't know if you have seen Todd's paper "
[00:25:35.26],Liz,"I may or may not please just send it to me, I would be, I would be very interested "
[00:25:40.22],Jean,"I'll make a note to myself, to send you that paper and it was published"
[00:25:46.27],Liz,"Yeah well you know, points out what the biggest challenge and I hate to use the word failure but in my find that didn't look what we didn't accomplish, that we thought we would that we thought everybody in a room with NGSX, as it was at the time remember, a lot of changes because of what we learned first hub session that we saw that NGSX could serve as the moderator and what I saw when I saw the hubs and I remember we paid Bonnie, we paid Bonnie to go and sit in on hub groups and do some day to day how they were functioning and what they were learning, I listened very closely anecdotally, well they were all over the place because without a moderation to stir the pot and catalyze the learning, they didn't get nearly as much as out of the NGSX as I would have hoped. There was-"
[00:27:10.18],Jean, I think both catalyzing institutionalizing the learning 
[00:27:18.01],Liz,"So there was great variation from hub to hub, about what their takeaway from each of the hub session where they did an NGSX component, you know our first model was let's take turns and you be the moderator this week and you be the moderator the next time we get together and we thought that was kinda like full proof, the biggest takeaway for me and for you and Ryan was, oh woah that was, it's really important to have a highly trained moderator to mediate the learning "
[00:27:56.24],Jean,"And you're right, we have to make a note of this Maggie that we wanna spend some time, we used to think this could be up here driven, "
[00:28:07.14],Liz,"Yes that's were we started out, right."
[00:28:12.03],Jean,"That you need a highly skilled facilitator at the center and um, that's come home to us since spades with the last four or five years, no question about that"
[00:28:28.26],Liz,"Yeah that was the latest discovery, I think it changed our thinking and we tried to adjust for it in mid stream, but never the next set of the second of the new terrain was, okay we finished NGSX, so we need to start and apply that in our own classroom, try and design some story line, um so you know we did that not just because it was in Bryan's interest working on in his work but we needed to start to bring them back together and fill in the gaps that had been left initial experience of NGSX clearly by the second year, when we first started to talk about coherence, sequencing unpacking concepts things like that you could see that there were gaps, there were things that they didn't get from NGSX about, making thinking public about critical discussions, there were a lot of gaps and I think what we tried to do to adjust sort of so that in as needed, as they were applying it to working on units. So for me that was the biggest take away, they were convenient, they got people to come, you have to remember this was a time when people were not banging down the door to sign up for three years of coursework and you know 30 hours of professional learning, it was hard for me to instill those kinds of offerings so, I had to be, you know as diplomatic as possible about saying how can we get people to come, you know like on Maslow's hierarchy of needs, it's like well they are not gonna get takeaways if they are not there, let's first get me there. It's sounds so funny but so it was big challenge "
[00:30:55.19],Jean,"On the other hand when that second unit moved into instructional units, that was something that I think that groups grew into and advanced because they could see the utility of it [Liz: yes] for your courses"
[00:31:18.03],Jean,"That's when it, you know what, I think their learning really kicked in the second and third year, we all realize that, you know, because we learned it, when we first started we thought it was just a plug and play um, so I think it's all good teaching in classrooms, teach a lesson and you think it's gonna go great and it doesn't and you think and well boy when I come back tomorrow here's what I am gonna do come at this differently and that's what we did, might not have been ideal but it helped NGSX to grow and I think it influenced, the newer units that you were putting together, and it certainly helped solidify and bring together the groups, I thought the, I know you are interested in the hubs. Did we still call them hubs in year 2 and 3, we transitioned into unit groups, so you weren't necessarily working with your same hub, I think, do you remember Jean?"
[00:32:25.25],Jean,"That is correct, we didn't call them hubs and in fact the groups, sort of reconstituted themselves around- "
[00:32:37.25],Liz,"I think around what- right (unclear) right, and wasn't much a reason"
[00:32:48.08],Jean,"Two of those curriculum units are some of our popular units, not that they haven't undergone some improvement and strengthening so and so forth but roadkill which is now "
[00:33:09.00],Liz," the corn, harvest corn "
[00:33:09.29],Jean,"And harvest corn, are still present tools in Connecticut"
[00:33:19.15],Liz,And beyond because
[00:33:21.02],Jean,Oh and beyond
[00:33:23.00],Liz,"Well at least, I don't know if road kill has gotten NGSX gold seal of approval but I think"
[00:33:31.02],Jean,It's not call roadkill anymore
[00:33:37.24],Liz,"Right, and harvest corn has, that's something worth you know reflecting on so as an outcome, you know from this original group which again was a pioneering group early on that two units have gone on, the NGSX seal of approval as high quality next generation units. How many people get to work directly with you know Bryan Riser and Mark Novak on developed curriculum, I mean Jesus, quite the opportunity to sit in side by by side and work on it together "
[00:34:19.10],Jean,"Well even Michael and Bryan were feeling the way on this, I think that-"
[00:34:24.29],Liz,And they learned a lot too
[00:34:27.01],Jean,They learned a tremendous lot and both of them have gone on now and they are focusing only on curriculum but I think those two summers spent on curriculum were very definitive for the project
[00:34:53.08],Liz,"Right, it was closer to each teacher's work you know it's this is something I am gonna teach and the other wonderful thing from years 2 and 3 when although they weren't called hubs they were still inward groups that were drawing from multiple school districts, was the opportunity to work on curriculum with college faculty typically I am the knower and giver of wisdom and I give to you but here their role changed being peer and they were shoulder to shoulder as experiences classroom teachers have a great advantage, they had never written a NGSX type learning unit either so I thought that gives me great pride, I loved to watch them working together and learning together because it was a different dynamic that type of relationship and so, I felt fortunate to have those kinds of people who were willing to put egos aside for the most part and they, you know what this is really hard to write these units and give each other feedback and to listen to each other, that was very gratifying."
[00:36:23.01],Maggie,"Absolutely, speaking a little bit about the ego question, I would love to circle back a little bit to talk about the hub group mentors, I know that's a little bit going into different direction, so are there any, any last comment before we shift in that direction?"
[00:36:43.07],Liz,So back you year one hub group mentors
[00:36:47.28],Maggie," Year 1 and year 2, both either neither "
