timestamp,name,text
[00:36:53.06],Liz,"Okay, the year 1 hub leadership was very lack because it was you know driven from within so they each took a turn stepping up to the plate, some of the, without the mediation of the learning, discussions that are so important part of NGSX might take place very brief all answers are equally acceptable because we're all polite and we're being nice to each other and teacher believe that when you are in your classroom you accept all right answers and you say very good Sally, very good Jose, that's very interesting so there's no critical thinking or elevating of ideas things like that would get perpetuated, you can't call a molecule an air puppy because that's just plain wrong, would get perpetuated rather than having somebody to lead the conservation does it really matter what the name is? Or is it important we understand that this is very tiny piece of something and it behaves in a certain way that's very predictable, so teachers get hinge up on the right word and miss the bigger idea and I think that happens in hub groups, there was nobody to push back, I remember having a conservation on the phone with Bryan about it, I sat in on one of this session in a way biting my lip and thinking, uh I don't think that's supposed to happen, I had a conversation with Bryan and I said what are you thoughts and we went like a little ballistic, absolutely not! All answers are not equal, well but so, there was insufficient leadership of the hubs there was very democratic equal sometimes the faculty member just because of their status as faculty might take more of a leader role but at that stage, remember this is you know early 2013, they didn't know anything about NGSX and science than the people sitting around them they had no, no good of knowing any more about it so, the leadership in those groups were lacking, sometimes I think the attendance was sporadic, um I wouldn't be at all surprised or offended if the survey said, I thought the hub groups were a waste of time, you know we finished up early and we went home. And I think in many hub groups, possibly because of the faculty member. there was sometimes a lack of energy and that probably lessened the amount of change from it, I think there was a lack of leadership in general."
[00:40:30.17],Maggie,But then again-
[00:40:31.06],Liz,"Back to the original goal, you know let's get hubs so we can at least start getting people together around some common learning materials, it went, they showed up, they did the best they could given what they knew at the time, um they establish relationships you know teacher to teacher and teacher to faculty members, I think those were the high points, "
[00:41:00.21],Maggie,"Right and I think it's interesting to, I am curious to hear your thoughts on this, cause there were some survey responses that I saw, along the lines that the hubs were not everything I hoped they would be and a little more on the negative coherence side but there were also folks that had really positive experiences in their hub group is your impression that the more positive experiences are also a product of a leadership among the faculty members, similarly to how you were saying that it might be negative, the negative experiences might be a result of less energy or more negative energy from a leadership role"
[00:41:48.09],Liz,"Yeah, I mean as the state leader and I was, you know I was very dedicated to the cause and science education and so if I see a bad hub, I think oh god I gotta fix it somehow, that's not to say because I focused on fixing the problem, that's not to say that nothing good came of them but I was fully aware that there was a lot of diversity, a lot of variation in what the output were from hub to hub and it's the difference in personality, never, I didn't appoint the faculty member to be the leader I didn't think it would be fair to them, I invited them to be learners, alongside the people who thought in their region, so it was kind of a different kind of role, you know I didn't expect them step up to the plate and lead it think some of them when they perceived that the need for some leadership to stir the pot some, I think some of them just stepped up naturally because that's what they do. But yeah it wouldn't surprise me if people said, I didn't get much out of it cause I think that's true. So it's good that, if they all great reviews well then I am not learning enough, you know tell what was not so good and then I can learn from that, so I am glad that they were honest."
[00:43:34.02],Maggie,"Yeah that was definitely my impression that the variety of responses I think, to me signaled a little bit of honesty, and yeah I think. Just to clarify for my own sake, the problems or the challenges that we were talking about were they expand both years of the hub groups or were they more the first year hub groups that and then you were talking about how you worked to resolve some of the, especially the challenges in facilitation and leadership in the second year hub groups or are you talking about both?"
[00:44:11.06],Liz,"Ah, much more so the first, the first year hubs were working on their own, the second were, I forget exactly what they were called learning unit groups? Teams? Something, you chose your team, so there was choice, they chose teams on something that were teaching, they were very positive about working with other teachers who were teaching the same group that they were teaching, and there was very strong leadership in year 2 and year 3, most of the work were down over the summer session and we had learning leaders there, we had Sarah and Bryan and Jean and Mike, I don't know if there was anybody else? So we were always circulating among the works of the work was much controllable than went it was out in their hubs doing their own thing and completely different feeling in terms of leadership and staying focused and getting great feedback and sharing with others, so that was a big improvement and lessoned learned"
[00:45:33.29],Maggie,"Absolutely, very cool. Yeah I feel like I have learned a lot, I feel like we covered most of our questions do you have anything to add or follow up? Or anything you want to say Liz that you didn't"
[00:45:51.15],Liz,"Yeah I am looking at question 4 and I would like to say a little bit more about question 4, do I feel like that there were an overall positive outcome for the goal of NGSX implementation? That's loaded, that's loaded working in there, at the undergraduate high school or elementary level were they? So, again, there's one thing to learn, to look closely at the process of professional learning, what were the inputs, what did we do, how did it work, to look at the outcome, the positive outcomes I think we talked a lot about, if one of the outcomes we are looking at it is NGSX implementation, I would say we have a way to go, yes we touched as many school districts as we could, in project but you're still talking about one or two teachers from each school and so that limits it spreads. In other words when it spreads from the people who were at the core of the workshop they probably get the strongest dose of the medicine and then when they go back to their own school and they are talking to the teacher who teaches chemistry next door to them, that chemistry teacher might get a, definitely gets a more loose dose, might pick up one or two things that might make a difference but there's no guarantee on that, so farther you get away from people who had the direct experience, more dilute the effect is. I think in Connecticut as well as nationally NGSX implementation is still a widely defined term, what does that mean? And NGSS impact on teaching and learning that's like a whole other thing, when people talk about NGSS implementation, they say, yup I am teaching those standards, yup I am teaching waves, I am teaching this and I threw out that old unit and I put in this one. Yeah I am implementing it and my kids took a test this year. And, mostly everything will stay the same, where do I think Connecticut is how do I think new terrain may or may not have effected it, well alright, given the fact that I am not in that role anymore and I am not talking with teachers all the time in school so, I would have to say I am definitely have a very distant helicopter view from talking to colleagues who are still in the states and my input from the people I talk to is that high school have paid very little attention to NGSS, so there is not a high school NGSS assignment and for the most part, my sense is that they are pretty much teaching science the way they always taught science, implementation in elementary school or you know K through 8. maybe maybe the greatest impacts are at the middle grades 6 to 8, those are the kids who get to have science everyday, not so at the elementary school NGSS didn't change that as much as you know as much as the framework, the writers and the position statements all say, you know kids need to learn science in elementary school, you can say it till the cows come home but that doesn't change the way the school say is shaped so I have very minimal expectation about what any dramatic change that will take place in the elementary level or have taken place, I think maybe, the most impact will be felt at the middle grades they come to science, we have NGSX available to them, we have, there many more sample learning units that are available nationally now than there were back in 2013, sometimes the learning material can serve as a form professional development, not the best but there's no other way to reach so many teachers I would say, looking at it from a far now, minimal impact on NGSX implementation, that sounds very sad doesn't it?"
[00:51:30.28],Maggie,Jean you're still muted
[00:51:33.12],Jean, [talks while muted] I wanna dispute that just a little bit
[00:51:45.06],Liz,Was that too gloomy?
[00:51:47.25],Jean,"Well I think it's a matter of understanding what we mean NGSX implementation. I think if we go back historically, look at new terrain and the purpose for new terrain and then a project assent, came into being. Which had a very very different purpose and one of the purposes of that and the connection to the Connecticut Science Center, beginning to scale up, at least teachers awareness of NGSS and what was intended by the practices, what was intended by the cross cutting ideas so, and I think-"
[00:52:39.07],Liz,But I think more for pre-service teachers right? 
[00:52:42.15],Jean,"Right, it wasn't focused on pre-service teaching"
[00:52:49.04],Liz,Oh I thought it was
[00:52:49.21],Jean,"Not project assent. It was focused on elementary and middle school teachers, some high school teachers who came, I mean it focused on getting a group of teachers coming from the same building or the same district, so that- you know there would be more knowledge based in a school or district, so what happened over time "
[00:53:24.01],Liz,So you can maybe hope for-
[00:53:22.09],Jean, hmm?
[00:53:26.28],Liz,Maybe you can hope for whole school change if everybody is rowing in the same boat
[00:53:32.28],Jean,"Right and I think, some of the remarkable changes that came into being, especially in the elementary grade was the confidence that the teachers gained in changing their pedagogy, in science education and not having the kids just definition or parrot back, a particular kind of definition or understanding, it was a opening up to a door to productive talk so a lot of epistemic knowledge building tools, introduced to NGSX and where we not we may not be direct teachers to the, to each verse of NGSS, what assent did was equipped with more complex pedagogical tools to take back and I think that has been very successful, the-"
[00:54:48.18],Liz,"Even though schools have teachers that were participating, what's your best guess?"
[00:54:56.22],Jean,"Um we have to track down, that how many districts that are in the state and how many representative we have from all over the districts, but there are districts that are interesting to talk about from you know kind of a case study perspective, Ellington is one. For all kinds of reason, it can be, you would think it would be a more successful district. But what happened in Ellington is that, for example Liz Cole, who stayed with project assent for a number of years was promoted in that district and every time she was promoted, she had a say in the kind of professional development that wanted to bring into that district, "
[00:56:01.28],Liz,Those are the kind of outcomes in all of the MSP projects that always make me feel good
[00:56:09.29],Jean,And that should
[00:56:09.29],Liz,"The little seed, that's right, you hope that the little seed will grow, they will spread and become invasive seeds, so that's a success"
[00:56:19.28],Jean,"It is a success and the other successful piece at that was, we had funding to develop the pathway for administrators"
[00:56:33.16],Liz,Absolutely
[00:56:35.14],Jean,"And when we had that good working combination with the administrators coming to their day and half experience and finally understanding what all of this is about, NGSS business. They became much more supportive of their teachers and they became more knowledgeable when they made classroom observations, so I think--"
[00:57:02.27],Liz,Those are excellent
[00:57:06.14],Jean,"- that I have to think a little bit about, but I think there are ways in which you can say the system moved, but you can't say the whole cart moved but there are examples were system growth and system change really did play out"
[00:57:28.10],Liz,"Yeah, yes I would not dispute that at all. And also a lot of, when we focused on teachers, which is what we did with new terrain pay off wont really show up immediately, you gotta wait for the plant to grow before it yields flower you know, so those are more long term, you wont see the change systemically or in a large scale until there are enough free service teacher in school district that have gone through new kind of separation courses at both different institution, we reached in our project will take several years before we start to see um you know a wave happen and we knew that, we knew that at the time so, we don't have great ways to hold the high schools accountable for shifting to next gen science, so that's, that's sort of its own separate animal, if you succeed by middle school and get kids to understand how to think like a scientist, that science is a verb and not a noun, you know it's something you do, something you figure out, you scratch you head, you come at it in a different way, you piece it together, if more middle school kids experience science learning that way, so that few of them are turned off and more of them are turned on to this is interesting, I can do this then that would be a huge success, we have indirect ways of measuring that, you know by the time those middle schoolers get into high school, do they take more AP courses, do they take science elective, we don't have great ways of tracking it's all kind of indirect because you're dealing with human beings and just because a kid decides to become a music major doesn't mean they had a bad science experience"
[00:59:51.14],Jean,No absolutely not
[00:59:52.03],Maggie,Right right
[00:59:52.03],Jean,"But many of the doctors and nurses and the X-ray technicians, that I speak to just in my private life and I often ask them, how did you get into this!? Why did you choose this? 9 times out of 10 they said I had an amazing, high school, teacher. Who made it so interesting, I had an amazing science teacher, just one. You know, that's the story"
[01:00:21.03],Jean,"That's sometimes all it takes and that's why, I feel that approaching and understand of NGSX by helping teachers change their pedagogy in science is important. I mean you can give them NGSS but it's just such a dry weed. "
[01:00:43.23],Liz,Yup
[01:00:43.20],Jean,"Help me here, this is a different, I am going to get excited about with my kids, but"
[01:00:51.09],Liz,"Exactly, exactly. And let them seize on to at least a part of it, kids thinking and expressing their thoughts, that would be great, instead just talking about nonsense. Question 6, could you speak to the experiences of diversity with the hub groups, oh yeah there was a lot of diversity, any conjectures to why that might have bent the case? Maggie you feel that we have cover that?"
[01:01:26.27],Maggie,"Yeah, that was kind of my follow up question about the idea of leadership and if that might account for some of those differences, the kind of energy that the repliers brought, but if you still-- please yeah"
[01:01:42.09],Liz,"They were not designed to have leadership, we thought that NGSX was going to going to be the leader and then we learned that didn't work, so whatever leadership occurred was very sporadic personality dependent. That my conjecture"
[01:02:01.28],Jean,"Oh I think you're right on that I mean, at the end of the day it all goes back to the individual person"
[01:02:12.00],Liz,"Maggie, in year two and three we really had a whole different format for the professional learning, mainly the, sometimes we did a one week, sometimes we did a two week summer institute were we were all together everyday, and I was there and I set the tone every morning and I was there to go with the groups and we had a leadership team, yeah that's what we were, we were a leadership team, we were there, so I don't think there was anybody feeling like what the heck is this all about, and I am sure there were people who were trying to figure that out in the hubs because I wasn't there on the hubs, we couldn't be there were too many in too many parts of the state, so we tried to drop in when we could, that made a big difference so, "
[01:03:08.20],Jean,"Well we didn't have a cheerleader, in the state, sacred heart wasn't able to perform that role"
[01:03:17.12],Liz,Exactly
[01:03:23.05],Jean,"But you know one of my fondest memories of new terrain, it is sitting with the two kindergarten teachers, eventually three, who put together the corn unit and talking, and through dialogue, giving them permission to change what they had always come to understand science to be in first and second grade. "
[01:03:54.13],Liz,"Yeah, it was very invigorating."
[01:03:55.08],Jean,it was and once they have themselves permission to take it in a entirely new direction and it was all with this little experiment they had done in their class room and make something more of it for other kids
[01:04:18.27],Liz,"I don't think that they had change, that enlighten would have happened, had they had not been, remember how Bryan and Mike would schedule meetings and each group would come, they had direct dialogue questioning pressing do you think it's like, so without that component I think the units would have been pretty traditional looking, so I just felt that, that was so rewarding"
[01:04:57.12],Jean,"Well you might think about it this way, oh. A little bit more, it was a remarkable summer, I think it was the second week"
[01:05:16.18],Liz,"I should write that down, I loved what you just said, I should write that down. That will make me even happier in my retirement, it was a remarkable summer"
[01:05:27.02],Jean,It was good despite several explosions
[01:05:31.09],Liz,"Oh god yes, I didn't say I wanna re-live it, I wouldn't wanna relive it but it was remarkable summer in many ways "
[01:05:40.01],Jean, In many ways 
[01:05:41.04],Liz,"You know that was the, the other lesson you pull together, so many different personalities and so many different ways of thinking, there's bound to be rough buds, overall we can say change happens, it was a remarkable summer, I count that as a success, so when is this article gonna get written?"
[01:06:09.21],Jean,"I hope, that within the next month we have a draft"
[01:06:14.24],Liz,"Yeah, well are you and Maggie both writing or?"
[01:06:24.00],Jean,"We may send it to you, we may send it to Cindy, we might send it to some other people and have them road test it"
[01:06:32.00],Liz,"I will definitely be happy, to give you feedback, of course I am interested in how it all get's put together and what message comes of it, I but I think it's I appreciate it that you are interested in it enough to do all this work "
[01:06:53.27],Jean,"Well it's gonna be a project, we've had several things to write and so there's been a little bit of a competition for time but I think, we're writing an article for a book that's going to be published in Denmark, is it Maggie?"
[01:07:17.16],Maggie," I think Denmark or Sweden? One of the Nordic countries, I am not sure"
[01:07:23.14],Jean,"And it's about teacher agency and student agency in science teaching and learning and again we're pulling from projects that we have done and another thing that learned overtime that we focus the work around the development of agency and teachers, in service of them developing similar things in their student and looking at students from a assets perspective"
[01:07:59.25],Liz,"And not from a deficit, oh boy that's huge"
[01:08:03.05],Jean,Yeah
[01:08:03.24],Liz,That is huge and valuing differences
[01:08:08.17],Jean,And especially in this day and age when they is such great diversity in our country.
[01:08:18.01],Liz,"And you know what I am realizing, it's just not diversity in appearance or color or intellect but just different ways of seeing the world, like my grandson is 5 and half years old now, he's quite different than his younger sister, they both of course are brilliant you know gifted and all that but he asks questions, he has interesting insightful questions and I always say that's a really good question, hmm let's think about that. I fear for him and kids like that, school will extinguish that because teachers don't value questions, especially questions out of the box, his questions are not wacko but they are really, woah that's a really good question let's think about that, a lot of teachers don't have time, don't have the time, not have interest in your questions that's not what we're learning about today, just afraid that formal education will turn that off in him. I hope not. But that's another kind of diversity, diversity in how people think and how they express their thoughts, it's a really hard job being a teacher."
[01:09:42.00],Maggie,Yeah I admire you
[01:09:44.18],Jean,Cause we're learning that it's not a scripted profession
[01:09:48.16],Liz,"That's right, we're dealing with human beings"
[01:09:52.09],Jean,"There some people, teachers that still wanna follow a script, but they're not gonna help the Zach's of the world and so we have to provide kind of blueprint"
[01:10:06.18],Liz,We're here! Amen!
[01:10:07.08],Jean,We will let you know when the draft it ready 
[01:10:12.06],Liz,"Please do, please do and thank you for including me in the process, it's always fun to talk with you guys, you girls"
[01:10:20.24],Everyone,[Says thanks to one another]
,,
